{
  "format": 1,
  "name": "main",
  "settings": {},
  "entities": [
    {
      "id": "eeeeeee1",
      "name": "Camera",
      "enabled": true,
      "tags": [],
      "layer": 0,
      "transform": {
        "pos": [
          320,
          180,
          0
        ],
        "rot": [
          0,
          0,
          0
        ],
        "scale": [
          1,
          1,
          1
        ]
      },
      "components": [
        {
          "type": "camera",
          "zoom": 1
        }
      ],
      "scripts": [],
      "children": [],
      "prefab": null
    },
    {
      "id": "eeeeeee2",
      "name": "Game",
      "enabled": true,
      "tags": [],
      "layer": 0,
      "transform": {
        "pos": [
          0,
          0,
          0
        ],
        "rot": [
          0,
          0,
          0
        ],
        "scale": [
          1,
          1,
          1
        ]
      },
      "components": [],
      "scripts": [
        {
          "path": "scripts/game2048.js",
          "attributes": {}
        }
      ],
      "children": [],
      "prefab": null
    }
  ]
}
