{
 "format": 1,
 "name": "split",
 "settings": {
  "ambientIntensity": 0
 },
 "entities": [
  {
   "id": "cam1",
   "name": "Camera",
   "enabled": true,
   "tags": [],
   "layer": 0,
   "transform": {
    "pos": [
     0,
     9,
     0
    ],
    "rot": [
     90,
     0,
     0
    ],
    "scale": [
     1,
     1,
     1
    ]
   },
   "components": [
    {
     "type": "camera",
     "fov": 50
    }
   ],
   "scripts": [],
   "children": [],
   "prefab": null
  },
  {
   "id": "spr1",
   "name": "Sprite",
   "enabled": true,
   "tags": [],
   "layer": 0,
   "transform": {
    "pos": [
     0,
     0,
     0
    ],
    "rot": [
     90,
     0,
     0
    ],
    "scale": [
     12,
     12,
     12
    ]
   },
   "components": [
    {
     "type": "sprite",
     "texture": "assets/sprites/white.png"
    }
   ],
   "scripts": [],
   "children": [],
   "prefab": null
  },
  {
   "id": "lit1",
   "name": "Lamp",
   "enabled": true,
   "tags": [],
   "layer": 0,
   "transform": {
    "pos": [
     0,
     3,
     0
    ],
    "rot": [
     0,
     0,
     0
    ],
    "scale": [
     1,
     1,
     1
    ]
   },
   "components": [
    {
     "type": "light",
     "kind": "point",
     "intensity": 2,
     "range": 6,
     "color": "#ffffff"
    }
   ],
   "scripts": [],
   "children": [],
   "prefab": null
  }
 ]
}