{
  "format": 1,
  "name": "main",
  "settings": {
    "eventSheet": "events/main.events.json"
  },
  "entities": [
    {
      "id": "eeeeeee1",
      "name": "Ground",
      "enabled": true,
      "tags": [],
      "layer": 0,
      "transform": {
        "pos": [
          320,
          330,
          1
        ],
        "rot": [
          0,
          0,
          0
        ],
        "scale": [
          1,
          1,
          1
        ]
      },
      "components": [
        {
          "type": "sprite",
          "texture": "assets/sprites/square.png",
          "size": [
            640,
            60
          ],
          "tint": "#4c7a4a",
          "alpha": 1
        },
        {
          "type": "collider",
          "shape": "box",
          "size": [
            640,
            60
          ]
        }
      ],
      "scripts": [],
      "children": [],
      "prefab": null,
      "behaviors": [
        {
          "type": "Solid"
        }
      ]
    },
    {
      "id": "eeeeeee2",
      "name": "Runner",
      "enabled": true,
      "tags": [
        "player"
      ],
      "layer": 0,
      "transform": {
        "pos": [
          90,
          290,
          5
        ],
        "rot": [
          0,
          0,
          0
        ],
        "scale": [
          1,
          1,
          1
        ]
      },
      "components": [
        {
          "type": "sprite",
          "texture": "assets/sprites/square.png",
          "size": [
            22,
            30
          ],
          "tint": "#ebcb8b",
          "alpha": 1
        },
        {
          "type": "collider",
          "shape": "box",
          "size": [
            20,
            30
          ]
        }
      ],
      "scripts": [],
      "children": [],
      "prefab": null,
      "behaviors": [
        {
          "type": "Platform",
          "properties": {
            "maxSpeed": 0,
            "jumpStrength": 560,
            "gravity": 1500
          }
        }
      ]
    },
    {
      "id": "eeeeeee3",
      "name": "Hud",
      "enabled": true,
      "tags": [],
      "layer": 0,
      "transform": {
        "pos": [
          90,
          18,
          50
        ],
        "rot": [
          0,
          0,
          0
        ],
        "scale": [
          1,
          1,
          1
        ]
      },
      "components": [
        {
          "type": "text",
          "text": "",
          "size": 14,
          "color": "#eceff4"
        }
      ],
      "scripts": [],
      "children": [],
      "prefab": null
    },
    {
      "id": "eeeeeee4",
      "name": "Message",
      "enabled": true,
      "tags": [],
      "layer": 0,
      "transform": {
        "pos": [
          320,
          150,
          50
        ],
        "rot": [
          0,
          0,
          0
        ],
        "scale": [
          1,
          1,
          1
        ]
      },
      "components": [
        {
          "type": "text",
          "text": "",
          "size": 22,
          "color": "#2e3440"
        }
      ],
      "scripts": [],
      "children": [],
      "prefab": null
    }
  ]
}
