{
 "format": 1,
 "name": "amb",
 "settings": {
  "ambient": "#808080"
 },
 "entities": [
  {
   "id": "cam1",
   "name": "Camera",
   "enabled": true,
   "tags": [],
   "layer": 0,
   "transform": {
    "pos": [
     0,
     9,
     0
    ],
    "rot": [
     90,
     0,
     0
    ],
    "scale": [
     1,
     1,
     1
    ]
   },
   "components": [
    {
     "type": "camera",
     "fov": 50
    }
   ],
   "scripts": [],
   "children": [],
   "prefab": null
  },
  {
   "id": "gnd1",
   "name": "Ground",
   "enabled": true,
   "tags": [],
   "layer": 0,
   "transform": {
    "pos": [
     0,
     0,
     0
    ],
    "rot": [
     0,
     0,
     0
    ],
    "scale": [
     1,
     1,
     1
    ]
   },
   "components": [
    {
     "type": "mesh",
     "shape": "ground",
     "size": [
      20,
      0.2,
      20
     ]
    },
    {
     "type": "material",
     "color": "#ffffff",
     "roughness": 1
    }
   ],
   "scripts": [],
   "children": [],
   "prefab": null
  },
  {
   "id": "lit1",
   "name": "Lamp",
   "enabled": false,
   "tags": [],
   "layer": 0,
   "transform": {
    "pos": [
     0,
     3,
     0
    ],
    "rot": [
     0,
     0,
     0
    ],
    "scale": [
     1,
     1,
     1
    ]
   },
   "components": [
    {
     "type": "light",
     "kind": "point",
     "intensity": 2,
     "range": 6,
     "color": "#ffffff"
    }
   ],
   "scripts": [],
   "children": [],
   "prefab": null
  }
 ]
}