{"format": 1, "name": "sh", "settings": {}, "entities": [{"id": "cam1", "name": "Camera", "enabled": true, "tags": [], "layer": 0, "transform": {"pos": [0, 9, 0], "rot": [90, 0, 0], "scale": [1, 1, 1]}, "components": [{"type": "camera", "fov": 50}], "scripts": [], "children": [], "prefab": null}, {"id": "gnd1", "name": "Ground", "enabled": true, "tags": [], "layer": 0, "transform": {"pos": [0, 0, 0], "rot": [0, 0, 0], "scale": [1, 1, 1]}, "components": [{"type": "mesh", "shape": "ground", "size": [20, 0.2, 20]}, {"type": "material", "color": "#ffffff", "roughness": 1}], "scripts": [], "children": [], "prefab": null}, {"id": "box", "name": "Box", "enabled": true, "tags": [], "layer": 0, "transform": {"pos": [0, 2.5, 0], "rot": [0, 0, 0], "scale": [1, 1, 1]}, "components": [{"type": "mesh", "shape": "box", "size": [3, 0.5, 3]}, {"type": "material", "color": "#ffffff"}], "scripts": [], "children": [], "prefab": null}, {"id": "lit1", "name": "Lamp", "enabled": true, "tags": [], "layer": 0, "transform": {"pos": [0, 6, 0], "rot": [0, 0, 0], "scale": [1, 1, 1]}, "components": [{"type": "light", "kind": "point", "intensity": 3, "range": 14, "castShadows": false}], "scripts": [], "children": [], "prefab": null}]}