{"format": 1, "name": "many", "settings": {}, "entities": [{"id": "cam1", "name": "Camera", "enabled": true, "tags": [], "layer": 0, "transform": {"pos": [0, 9, 0], "rot": [90, 0, 0], "scale": [1, 1, 1]}, "components": [{"type": "camera", "fov": 50}], "scripts": [], "children": [], "prefab": null}, {"id": "gnd1", "name": "Ground", "enabled": true, "tags": [], "layer": 0, "transform": {"pos": [0, 0, 0], "rot": [0, 0, 0], "scale": [1, 1, 1]}, "components": [{"type": "mesh", "shape": "ground", "size": [20, 0.2, 20]}, {"type": "material", "color": "#ffffff", "roughness": 1}], "scripts": [], "children": [], "prefab": null}, {"id": "f0", "name": "Far0", "enabled": true, "tags": [], "layer": 0, "transform": {"pos": [-9, 2, -9], "rot": [0, 0, 0], "scale": [1, 1, 1]}, "components": [{"type": "light", "kind": "point", "intensity": 1, "range": 3}], "scripts": [], "children": [], "prefab": null}, {"id": "f1", "name": "Far1", "enabled": true, "tags": [], "layer": 0, "transform": {"pos": [0, 2, -9], "rot": [0, 0, 0], "scale": [1, 1, 1]}, "components": [{"type": "light", "kind": "point", "intensity": 1, "range": 3}], "scripts": [], "children": [], "prefab": null}, {"id": "f2", "name": "Far2", "enabled": true, "tags": [], "layer": 0, "transform": {"pos": [9, 2, -9], "rot": [0, 0, 0], "scale": [1, 1, 1]}, "components": [{"type": "light", "kind": "point", "intensity": 1, "range": 3}], "scripts": [], "children": [], "prefab": null}, {"id": "f3", "name": "Far3", "enabled": true, "tags": [], "layer": 0, "transform": {"pos": [-9, 2, 0], "rot": [0, 0, 0], "scale": [1, 1, 1]}, "components": [{"type": "light", "kind": "point", "intensity": 1, "range": 3}], "scripts": [], "children": [], "prefab": null}, {"id": "f5", "name": "Far5", "enabled": true, "tags": [], "layer": 0, "transform": {"pos": [9, 2, 0], "rot": [0, 0, 0], "scale": [1, 1, 1]}, "components": [{"type": "light", "kind": "point", "intensity": 1, "range": 3}], "scripts": [], "children": [], "prefab": null}, {"id": "f6", "name": "Far6", "enabled": true, "tags": [], "layer": 0, "transform": {"pos": [-9, 2, 9], "rot": [0, 0, 0], "scale": [1, 1, 1]}, "components": [{"type": "light", "kind": "point", "intensity": 1, "range": 3}], "scripts": [], "children": [], "prefab": null}, {"id": "f7", "name": "Far7", "enabled": true, "tags": [], "layer": 0, "transform": {"pos": [0, 2, 9], "rot": [0, 0, 0], "scale": [1, 1, 1]}, "components": [{"type": "light", "kind": "point", "intensity": 1, "range": 3}], "scripts": [], "children": [], "prefab": null}, {"id": "f8", "name": "Far8", "enabled": true, "tags": [], "layer": 0, "transform": {"pos": [9, 2, 9], "rot": [0, 0, 0], "scale": [1, 1, 1]}, "components": [{"type": "light", "kind": "point", "intensity": 1, "range": 3}], "scripts": [], "children": [], "prefab": null}, {"id": "f9", "name": "Far9", "enabled": true, "tags": [], "layer": 0, "transform": {"pos": [-9, 2, 18], "rot": [0, 0, 0], "scale": [1, 1, 1]}, "components": [{"type": "light", "kind": "point", "intensity": 1, "range": 3}], "scripts": [], "children": [], "prefab": null}, {"id": "lit1", "name": "Lamp", "enabled": true, "tags": [], "layer": 0, "transform": {"pos": [0, 3, 0], "rot": [0, 0, 0], "scale": [1, 1, 1]}, "components": [{"type": "light", "kind": "point", "intensity": 2, "range": 6}], "scripts": [], "children": [], "prefab": null}]}