{
  "format": 1,
  "name": "main",
  "settings": {},
  "entities": [
    {
      "id": "eeeeeee1",
      "name": "XKom",
      "enabled": true,
      "tags": [],
      "layer": 0,
      "transform": {
        "pos": [
          0,
          0,
          0
        ],
        "rot": [
          0,
          0,
          0
        ],
        "scale": [
          1,
          1,
          1
        ]
      },
      "components": [],
      "scripts": [
        {
          "path": "scripts/xkom.js",
          "attributes": {}
        }
      ],
      "children": [],
      "prefab": null
    }
  ]
}
