{
  "format": 1,
  "name": "main",
  "settings": {},
  "entities": [
    {
      "id": "sd00001",
      "name": "Camera",
      "enabled": true,
      "tags": [],
      "layer": 0,
      "transform": {
        "pos": [
          320,
          180,
          10
        ],
        "rot": [
          0,
          0,
          0
        ],
        "scale": [
          1,
          1,
          1
        ]
      },
      "components": [
        {
          "type": "camera",
          "zoom": 1
        }
      ],
      "scripts": [
        {
          "path": "scripts/follow.js",
          "attributes": {
            "target": "Hero"
          }
        }
      ],
      "children": [],
      "prefab": null
    },
    {
      "id": "sd00007",
      "name": "GameManager",
      "enabled": true,
      "tags": [],
      "layer": 0,
      "transform": {
        "pos": [
          0,
          0,
          0
        ],
        "rot": [
          0,
          0,
          0
        ],
        "scale": [
          1,
          1,
          1
        ]
      },
      "components": [],
      "scripts": [
        {
          "path": "scripts/GameManager.js",
          "attributes": {
            "startLives": 3
          }
        }
      ],
      "children": [],
      "prefab": null
    },
    {
      "id": "sd00002",
      "name": "Level",
      "enabled": true,
      "tags": [],
      "layer": 0,
      "transform": {
        "pos": [
          0,
          0,
          0
        ],
        "rot": [
          0,
          0,
          0
        ],
        "scale": [
          1,
          1,
          1
        ]
      },
      "components": [],
      "scripts": [
        {
          "path": "scripts/level.js",
          "attributes": {
            "tile": 32
          }
        }
      ],
      "children": [],
      "prefab": null
    },
    {
      "id": "sd00004",
      "name": "Hud",
      "enabled": true,
      "tags": [],
      "layer": 0,
      "transform": {
        "pos": [
          0,
          0,
          0
        ],
        "rot": [
          0,
          0,
          0
        ],
        "scale": [
          1,
          1,
          1
        ]
      },
      "components": [],
      "scripts": [
        {
          "path": "scripts/hud.js",
          "attributes": {}
        }
      ],
      "children": [],
      "prefab": null
    },
    {
      "id": "sd00003",
      "name": "Hero",
      "enabled": true,
      "tags": [
        "Hero"
      ],
      "layer": 0,
      "transform": {
        "pos": [
          96,
          96,
          2
        ],
        "rot": [
          0,
          0,
          0
        ],
        "scale": [
          1,
          1,
          1
        ]
      },
      "components": [
        {
          "type": "sprite",
          "texture": "assets/sprites/square.png",
          "size": [
            24,
            24
          ],
          "tint": "#88c0d0",
          "alpha": 1
        },
        {
          "type": "rigidbody",
          "mode": "dynamic"
        },
        {
          "type": "collider",
          "shape": "box",
          "size": [
            24,
            24
          ]
        }
      ],
      "scripts": [
        {
          "path": "scripts/hero.js",
          "attributes": {
            "speed": 170
          }
        },
        {
          "path": "scripts/health.js",
          "attributes": {
            "grace": 1
          }
        }
      ],
      "children": [],
      "prefab": null
    }
  ]
}
