{
  "format": 1,
  "name": "main",
  "settings": {},
  "entities": [
    {
      "id": "cam00001",
      "name": "Camera",
      "enabled": true,
      "tags": [],
      "layer": 0,
      "transform": {
        "pos": [
          320,
          180,
          0
        ],
        "rot": [
          0,
          0,
          0
        ],
        "scale": [
          1,
          1,
          1
        ]
      },
      "components": [
        {
          "type": "camera"
        }
      ],
      "scripts": [],
      "children": [],
      "prefab": null
    },
    {
      "id": "cam3d001",
      "name": "Camera3D",
      "enabled": true,
      "tags": [],
      "layer": 0,
      "transform": {
        "pos": [
          0,
          0,
          -6
        ],
        "rot": [
          0,
          0,
          0
        ],
        "scale": [
          1,
          1,
          1
        ]
      },
      "components": [
        {
          "type": "camera",
          "fov": 50
        }
      ],
      "scripts": [],
      "children": [],
      "prefab": null
    },
    {
      "id": "sun00001",
      "name": "Sun",
      "enabled": true,
      "tags": [],
      "layer": 0,
      "transform": {
        "pos": [
          0,
          5,
          0
        ],
        "rot": [
          50,
          -30,
          0
        ],
        "scale": [
          1,
          1,
          1
        ]
      },
      "components": [
        {
          "type": "light",
          "kind": "directional",
          "intensity": 1.2
        }
      ],
      "scripts": [],
      "children": [],
      "prefab": null
    },
    {
      "id": "path0001",
      "name": "Path",
      "enabled": true,
      "tags": [],
      "layer": 0,
      "transform": {
        "pos": [
          0,
          0,
          0
        ],
        "rot": [
          0,
          0,
          0
        ],
        "scale": [
          1,
          1,
          1
        ]
      },
      "components": [
        {
          "type": "path",
          "points": [
            [
              -2,
              1,
              0
            ],
            [
              2,
              1,
              0
            ],
            [
              2,
              -1,
              0
            ],
            [
              -2,
              -1,
              0
            ]
          ],
          "loop": true
        }
      ],
      "scripts": [],
      "children": [],
      "prefab": null
    },
    {
      "id": "mover001",
      "name": "Mover",
      "enabled": true,
      "tags": [
        "mover"
      ],
      "layer": 0,
      "transform": {
        "pos": [
          0,
          0,
          0
        ],
        "rot": [
          0,
          0,
          0
        ],
        "scale": [
          1,
          1,
          1
        ]
      },
      "components": [
        {
          "type": "sprite",
          "texture": "assets/sprites/coin.png",
          "frame": 0,
          "size": [
            24,
            24
          ]
        },
        {
          "type": "mesh",
          "shape": "sphere",
          "size": [
            0.6,
            0.6,
            0.6
          ]
        },
        {
          "type": "material",
          "color": "#88c0d0",
          "metallic": 0.2,
          "roughness": 0.4
        }
      ],
      "scripts": [
        {
          "path": "scripts/mover.js",
          "attributes": {
            "speed": 1.5,
            "scale2d": 60
          }
        }
      ],
      "children": [],
      "prefab": null
    },
    {
      "id": "spwn0001",
      "name": "Spawner",
      "enabled": true,
      "tags": [],
      "layer": 0,
      "transform": {
        "pos": [
          0,
          1.5,
          0
        ],
        "rot": [
          0,
          0,
          0
        ],
        "scale": [
          1,
          1,
          1
        ]
      },
      "components": [
        {
          "type": "spawner",
          "prefab": "prefabs/orb.prefab.json",
          "interval": 0.3,
          "max": 3,
          "jitter": [
            1,
            0,
            0
          ]
        }
      ],
      "scripts": [],
      "children": [],
      "prefab": null
    },
    {
      "id": "hud00001",
      "name": "Hud",
      "enabled": true,
      "tags": [],
      "layer": 0,
      "transform": {
        "pos": [
          0,
          0,
          0
        ],
        "rot": [
          0,
          0,
          0
        ],
        "scale": [
          1,
          1,
          1
        ]
      },
      "components": [
        {
          "type": "uiLabel",
          "text": "ready",
          "x": 10,
          "y": 8,
          "size": 18
        }
      ],
      "scripts": [
        {
          "path": "scripts/probe.js"
        }
      ],
      "children": [],
      "prefab": null
    }
  ]
}