{
  "format": 1,
  "name": "main",
  "settings": {},
  "entities": [
    {
      "id": "sd00001",
      "name": "Camera",
      "enabled": true,
      "tags": [],
      "layer": 0,
      "transform": {
        "pos": [
          320,
          180,
          10
        ],
        "rot": [
          0,
          0,
          0
        ],
        "scale": [
          1,
          1,
          1
        ]
      },
      "components": [
        {
          "type": "camera",
          "zoom": 1
        }
      ],
      "scripts": [],
      "children": [],
      "prefab": null
    },
    {
      "id": "sd00002",
      "name": "Floor",
      "enabled": true,
      "tags": [],
      "layer": 0,
      "transform": {
        "pos": [
          320,
          180,
          -5
        ],
        "rot": [
          0,
          0,
          0
        ],
        "scale": [
          1,
          1,
          1
        ]
      },
      "components": [
        {
          "type": "sprite",
          "texture": "assets/sprites/square.png",
          "size": [
            640,
            360
          ],
          "tint": "#2e3440",
          "alpha": 1
        }
      ],
      "scripts": [],
      "children": [],
      "prefab": null
    },
    {
      "id": "sd00003",
      "name": "Hero",
      "enabled": true,
      "tags": [
        "Hero"
      ],
      "layer": 0,
      "transform": {
        "pos": [
          320,
          180,
          2
        ],
        "rot": [
          0,
          0,
          0
        ],
        "scale": [
          1,
          1,
          1
        ]
      },
      "components": [
        {
          "type": "sprite",
          "texture": "assets/sprites/square.png",
          "size": [
            24,
            24
          ],
          "tint": "#88c0d0",
          "alpha": 1
        }
      ],
      "scripts": [
        {
          "path": "scripts/hero.js",
          "attributes": {
            "speed": 160
          }
        }
      ],
      "children": [],
      "prefab": null
    }
  ]
}
