{
  "format": 1,
  "name": "main",
  "settings": {},
  "entities": [
    {
      "id": "eeeeee65",
      "name": "Camera",
      "enabled": true,
      "tags": [],
      "layer": 0,
      "transform": {
        "pos": [
          320,
          180,
          0
        ],
        "rot": [
          0,
          0,
          0
        ],
        "scale": [
          1,
          1,
          1
        ]
      },
      "components": [
        {
          "type": "camera",
          "zoom": 1
        }
      ],
      "scripts": [],
      "children": [],
      "prefab": null
    },
    {
      "id": "eeeeee66",
      "name": "Road0",
      "enabled": true,
      "tags": [],
      "layer": 0,
      "transform": {
        "pos": [
          80,
          90,
          -2
        ],
        "rot": [
          0,
          0,
          0
        ],
        "scale": [
          1,
          1,
          1
        ]
      },
      "components": [
        {
          "type": "sprite",
          "texture": "assets/sprites/square.png",
          "size": [
            194,
            34
          ],
          "tint": "#a3825c",
          "alpha": 1
        }
      ],
      "scripts": [],
      "children": [],
      "prefab": null
    },
    {
      "id": "eeeeee67",
      "name": "Road1",
      "enabled": true,
      "tags": [],
      "layer": 0,
      "transform": {
        "pos": [
          160,
          180,
          -2
        ],
        "rot": [
          0,
          0,
          0
        ],
        "scale": [
          1,
          1,
          1
        ]
      },
      "components": [
        {
          "type": "sprite",
          "texture": "assets/sprites/square.png",
          "size": [
            34,
            214
          ],
          "tint": "#a3825c",
          "alpha": 1
        }
      ],
      "scripts": [],
      "children": [],
      "prefab": null
    },
    {
      "id": "eeeeee68",
      "name": "Road2",
      "enabled": true,
      "tags": [],
      "layer": 0,
      "transform": {
        "pos": [
          250,
          270,
          -2
        ],
        "rot": [
          0,
          0,
          0
        ],
        "scale": [
          1,
          1,
          1
        ]
      },
      "components": [
        {
          "type": "sprite",
          "texture": "assets/sprites/square.png",
          "size": [
            214,
            34
          ],
          "tint": "#a3825c",
          "alpha": 1
        }
      ],
      "scripts": [],
      "children": [],
      "prefab": null
    },
    {
      "id": "eeeeee69",
      "name": "Road3",
      "enabled": true,
      "tags": [],
      "layer": 0,
      "transform": {
        "pos": [
          340,
          180,
          -2
        ],
        "rot": [
          0,
          0,
          0
        ],
        "scale": [
          1,
          1,
          1
        ]
      },
      "components": [
        {
          "type": "sprite",
          "texture": "assets/sprites/square.png",
          "size": [
            34,
            214
          ],
          "tint": "#a3825c",
          "alpha": 1
        }
      ],
      "scripts": [],
      "children": [],
      "prefab": null
    },
    {
      "id": "eeeeee6a",
      "name": "Road4",
      "enabled": true,
      "tags": [],
      "layer": 0,
      "transform": {
        "pos": [
          430,
          90,
          -2
        ],
        "rot": [
          0,
          0,
          0
        ],
        "scale": [
          1,
          1,
          1
        ]
      },
      "components": [
        {
          "type": "sprite",
          "texture": "assets/sprites/square.png",
          "size": [
            214,
            34
          ],
          "tint": "#a3825c",
          "alpha": 1
        }
      ],
      "scripts": [],
      "children": [],
      "prefab": null
    },
    {
      "id": "eeeeee6b",
      "name": "Road5",
      "enabled": true,
      "tags": [],
      "layer": 0,
      "transform": {
        "pos": [
          520,
          155,
          -2
        ],
        "rot": [
          0,
          0,
          0
        ],
        "scale": [
          1,
          1,
          1
        ]
      },
      "components": [
        {
          "type": "sprite",
          "texture": "assets/sprites/square.png",
          "size": [
            34,
            164
          ],
          "tint": "#a3825c",
          "alpha": 1
        }
      ],
      "scripts": [],
      "children": [],
      "prefab": null
    },
    {
      "id": "eeeeee6c",
      "name": "Road6",
      "enabled": true,
      "tags": [],
      "layer": 0,
      "transform": {
        "pos": [
          580,
          220,
          -2
        ],
        "rot": [
          0,
          0,
          0
        ],
        "scale": [
          1,
          1,
          1
        ]
      },
      "components": [
        {
          "type": "sprite",
          "texture": "assets/sprites/square.png",
          "size": [
            154,
            34
          ],
          "tint": "#a3825c",
          "alpha": 1
        }
      ],
      "scripts": [],
      "children": [],
      "prefab": null
    },
    {
      "id": "eeeeee6d",
      "name": "Game",
      "enabled": true,
      "tags": [],
      "layer": 0,
      "transform": {
        "pos": [
          0,
          0,
          0
        ],
        "rot": [
          0,
          0,
          0
        ],
        "scale": [
          1,
          1,
          1
        ]
      },
      "components": [],
      "scripts": [
        {
          "path": "scripts/td.js",
          "attributes": {
            "path": [
              [
                0,
                90
              ],
              [
                160,
                90
              ],
              [
                160,
                270
              ],
              [
                340,
                270
              ],
              [
                340,
                90
              ],
              [
                520,
                90
              ],
              [
                520,
                220
              ],
              [
                640,
                220
              ]
            ]
          }
        },
        {
          "path": "scripts/ui-gameover.js",
          "attributes": {}
        },
        {
          "path": "scripts/util-sfx.js",
          "attributes": {}
        }
      ],
      "children": [],
      "prefab": null
    }
  ]
}
