{
  "format": 1,
  "name": "menu",
  "settings": {
    "eventSheet": "events/menu.events.json"
  },
  "entities": [
    {
      "id": "eeeeeee1",
      "name": "Background",
      "enabled": true,
      "tags": [],
      "layer": 0,
      "transform": {
        "pos": [
          320,
          180,
          -10
        ],
        "rot": [
          0,
          0,
          0
        ],
        "scale": [
          1,
          1,
          1
        ]
      },
      "components": [
        {
          "type": "sprite",
          "texture": "assets/sprites/square.png",
          "size": [
            640,
            360
          ],
          "tint": "#2e3440",
          "alpha": 1
        }
      ],
      "scripts": [],
      "children": [],
      "prefab": null
    },
    {
      "id": "eeeeeee2",
      "name": "Title",
      "enabled": true,
      "tags": [],
      "layer": 0,
      "transform": {
        "pos": [
          0,
          0,
          0
        ],
        "rot": [
          0,
          0,
          0
        ],
        "scale": [
          1,
          1,
          1
        ]
      },
      "components": [
        {
          "type": "uiLabel",
          "text": "title",
          "textKey": "title",
          "x": 0,
          "y": -110,
          "anchor": "c",
          "size": 44
        }
      ],
      "scripts": [],
      "children": [],
      "prefab": null
    },
    {
      "id": "eeeeeee3",
      "name": "PlayButton",
      "enabled": true,
      "tags": [],
      "layer": 0,
      "transform": {
        "pos": [
          0,
          0,
          0
        ],
        "rot": [
          0,
          0,
          0
        ],
        "scale": [
          1,
          1,
          1
        ]
      },
      "components": [
        {
          "type": "uiButton",
          "text": "play",
          "textKey": "play",
          "x": 0,
          "y": -30,
          "anchor": "c",
          "w": 220,
          "event": "play"
        }
      ],
      "scripts": [],
      "children": [],
      "prefab": null
    },
    {
      "id": "eeeeeee4",
      "name": "OptionsButton",
      "enabled": true,
      "tags": [],
      "layer": 0,
      "transform": {
        "pos": [
          0,
          0,
          0
        ],
        "rot": [
          0,
          0,
          0
        ],
        "scale": [
          1,
          1,
          1
        ]
      },
      "components": [
        {
          "type": "uiButton",
          "text": "options",
          "textKey": "options",
          "x": 0,
          "y": 30,
          "anchor": "c",
          "w": 220,
          "event": "options"
        }
      ],
      "scripts": [],
      "children": [],
      "prefab": null
    }
  ]
}
