{
 "format": 1,
 "name": "sprite",
 "settings": {
  "ambient": "#ffffff"
 },
 "entities": [
  {
   "id": "cam1",
   "name": "Camera",
   "enabled": true,
   "tags": [],
   "layer": 0,
   "transform": {
    "pos": [
     0,
     9,
     0
    ],
    "rot": [
     90,
     0,
     0
    ],
    "scale": [
     1,
     1,
     1
    ]
   },
   "components": [
    {
     "type": "camera",
     "fov": 50
    }
   ],
   "scripts": [],
   "children": [],
   "prefab": null
  },
  {
   "id": "spr1",
   "name": "Sprite",
   "enabled": true,
   "tags": [],
   "layer": 0,
   "transform": {
    "pos": [
     0,
     0,
     0
    ],
    "rot": [
     90,
     0,
     0
    ],
    "scale": [
     8,
     8,
     8
    ]
   },
   "components": [
    {
     "type": "sprite",
     "texture": "assets/sprites/white.png"
    }
   ],
   "scripts": [],
   "children": [],
   "prefab": null
  }
 ]
}