{"format": 1, "name": "modelrig", "settings": {}, "entities": [{"id": "cam1", "name": "Camera", "enabled": true, "tags": [], "layer": 0, "transform": {"pos": [0, 6, -6], "rot": [45, 0, 0], "scale": [1, 1, 1]}, "components": [{"type": "camera", "fov": 50}], "scripts": [], "children": [], "prefab": null}, {"id": "gnd1", "name": "Ground", "enabled": true, "tags": [], "layer": 0, "transform": {"pos": [0, 0, 0], "rot": [0, 0, 0], "scale": [1, 1, 1]}, "components": [{"type": "mesh", "shape": "ground", "size": [30, 0.2, 30]}, {"type": "material", "color": "#ffffff", "roughness": 1}], "scripts": [], "children": [], "prefab": null}, {"id": "moon", "name": "Moon", "enabled": true, "tags": [], "layer": 0, "transform": {"pos": [0, 10, 0], "rot": [50, -30, 0], "scale": [1, 1, 1]}, "components": [{"type": "light", "kind": "directional", "intensity": 0.4, "color": "#7f98ff"}], "scripts": [], "children": [], "prefab": null}, {"id": "amb", "name": "Ambient", "enabled": true, "tags": [], "layer": 0, "transform": {"pos": [0, 0, 0], "rot": [0, 0, 0], "scale": [1, 1, 1]}, "components": [{"type": "light", "kind": "hemispheric", "intensity": 0.3, "color": "#3a4688"}], "scripts": [], "children": [], "prefab": null}, {"id": "cube", "name": "Cube", "enabled": true, "tags": [], "layer": 0, "transform": {"pos": [0, 1, 0], "rot": [0, 0, 0], "scale": [1, 1, 1]}, "components": [{"type": "model", "path": "models/testCmesh.glb", "shadow": true}], "scripts": [], "children": [{"id": "lamp", "name": "Lamp", "enabled": true, "tags": [], "layer": 0, "transform": {"pos": [0, 2.5, 0], "rot": [0, 0, 0], "scale": [1, 1, 1]}, "components": [{"type": "light", "kind": "point", "intensity": 6.2, "castShadows": true}], "scripts": [], "children": [], "prefab": null}], "prefab": null}]}